{
  "schema_version": "simworld.vista.playable-home-hssd-private-research-profile/v1",
  "profile_id": "hssd_private_research_r1",
  "house_id": "home.r1",
  "house_revision": "vista_playable_home_r1",
  "source_house_content_digest": "51208e0ecc1ad1450ca6d9b14a4fb46989bff90fd8dc15422a0a47df6827c8c3",
  "source_binding_plan": {
    "schema_version": "simworld.vista.playable-home-hssd-binding-plan/v1",
    "content_digest": "07ba1221aac1bfd39651953cdf932bbb7d43e39f94d4107020aa96d1b43db44b",
    "source_normalized_manifest_digest": "fa74ca115fb93e3ab658a5b253b96615bdcf3390d5bf9afbb01a7b05e50ea745"
  },
  "dataset": {
    "name": "Habitat Synthetic Scenes Dataset (HSSD)",
    "project_url": "https://3dlg-hcvc.github.io/hssd/",
    "dataset_revision": "4369cb9876214c7fbebcf552eb532380e4d287e4",
    "readme_relpath": "README.md",
    "readme_sha256": "4509914d584031173390bf5f41722ec25e19de3f1e0ea54a423eadf63073d49c",
    "license": {
      "spdx": "CC-BY-NC-4.0",
      "url": "https://creativecommons.org/licenses/by-nc/4.0/",
      "attribution_required": true,
      "modification_notice_required": true,
      "commercial_use": "prohibited_without_separate_permission"
    }
  },
  "license_scope": {
    "use_class": "private_noncommercial_research_only",
    "commercial_release": "blocked",
    "public_payload_distribution": "prohibited",
    "attribution_notice": "HSSD source models; deterministically normalized and used only for private non-commercial VISTA World research."
  },
  "payload_policy": {
    "git_contents": "manifests_digests_licenses_and_recipes_only",
    "binary_payload_location": "outside_git_required",
    "accepted_build_outputs": "append_only_outside_git",
    "network_fallback": "disabled"
  },
  "texture_transport_policy": {
    "source_extension": "KHR_texture_basisu",
    "transport_required": true,
    "required_mode": "KHR_texture_basisu_to_core_png",
    "source_basisu_required": true,
    "output_basisu_required": false,
    "output_image_transport": "embedded_core_png",
    "receipt_policy": "per_asset_hash_pinned_required_before_import",
    "missing_transport_policy": "reject"
  },
  "source_assets": [
    {"source_asset_id":"hssd.static.bag","semantic_category":"bag","model_id":"f84abae51adc16259a50c3ef697baec4f7c7737c","render_asset_relpath":"objects/f/f84abae51adc16259a50c3ef697baec4f7c7737c.glb","render_asset_sha256":"80c46119dfb1500146a24d31824e1b0d2be71150b4fc0fb3093d9342c0951973","object_config_relpath":"objects/f/f84abae51adc16259a50c3ef697baec4f7c7737c.object_config.json","object_config_sha256":"0d1f83bc5aa2b90aae2a9794df6831d54a5ceaa9e2cb17456333369383bfd1cc","source_basisu_required":true,"normalized_dimensions_m":[0.53,0.235,0.5],"normalized_origin_policy":"footprint_center_bottom_z_zero","visual_role":"static_presentation_shell","interaction_authority":"none_static_joined_glb"},
    {"source_asset_id":"hssd.static.bathtub","semantic_category":"bathtub","model_id":"5e387d4901ed77146f50f220ebdf7b30ad36b631","render_asset_relpath":"objects/5/5e387d4901ed77146f50f220ebdf7b30ad36b631.glb","render_asset_sha256":"a29283fca8cfdc4ef040826a489094e62f3f7e4f02ce5805cdba91f67f9ac39b","object_config_relpath":"objects/5/5e387d4901ed77146f50f220ebdf7b30ad36b631.object_config.json","object_config_sha256":"77752cd77d4be994a0cc39601bf4f4c8784395c4bb47572d305a7c43d8a1316c","source_basisu_required":true,"normalized_dimensions_m":[1.55,0.78,0.95],"normalized_origin_policy":"footprint_center_bottom_z_zero","visual_role":"static_presentation_shell","interaction_authority":"none_static_joined_glb"},
    {"source_asset_id":"hssd.static.bed","semantic_category":"bed","model_id":"55e6e00a10ded488a216deec65cd73b73cef65a5","render_asset_relpath":"objects/5/55e6e00a10ded488a216deec65cd73b73cef65a5.glb","render_asset_sha256":"d8807bc6e541dfcb0162bb6902ac70e75a90e3c21375326faf298d952a1e2704","object_config_relpath":"objects/5/55e6e00a10ded488a216deec65cd73b73cef65a5.object_config.json","object_config_sha256":"90f99fbac85977b761f9d6153586822a5690c39d1aeee10ec4a5a45b6168f21b","source_basisu_required":true,"normalized_dimensions_m":[1.8,2.11,1.115],"normalized_origin_policy":"footprint_center_bottom_z_zero","visual_role":"static_presentation_shell","interaction_authority":"none_static_joined_glb"},
    {"source_asset_id":"hssd.static.cabinet","semantic_category":"cabinet","model_id":"7c85d0a371c5be2f5de0883e0c2125bd77de73f5","render_asset_relpath":"objects/7/7c85d0a371c5be2f5de0883e0c2125bd77de73f5.glb","render_asset_sha256":"d43e9ccd5d75aafdeb2b275e803a166c970449646646fd75616b7511e3c320ce","object_config_relpath":"objects/7/7c85d0a371c5be2f5de0883e0c2125bd77de73f5.object_config.json","object_config_sha256":"97cd733fc2b9bafaa251dfb2b58dcf03b3fdd41fec92bd05ec2f11462c5b372f","source_basisu_required":true,"normalized_dimensions_m":[0.95,0.598,2.2],"normalized_origin_policy":"footprint_center_bottom_z_zero","visual_role":"static_presentation_shell","interaction_authority":"none_static_joined_glb"},
    {"source_asset_id":"hssd.static.storage_box","semantic_category":"storage_box","model_id":"48a05af7c5452b07c94665f2b0bfdab2c9a3466c","render_asset_relpath":"objects/4/48a05af7c5452b07c94665f2b0bfdab2c9a3466c.glb","render_asset_sha256":"e07faa55d145f3b844b1c0b9ce8fc7136db22124b8abc8ed4fb59b6c81d8818f","object_config_relpath":"objects/4/48a05af7c5452b07c94665f2b0bfdab2c9a3466c.object_config.json","object_config_sha256":"25af0928c09e42b68db21d4524ea73c63ce1e834a775983fd96acc0bac73084b","source_basisu_required":true,"normalized_dimensions_m":[0.5,0.385,0.3625],"normalized_origin_policy":"footprint_center_bottom_z_zero","visual_role":"static_presentation_shell","interaction_authority":"none_static_joined_glb"},
    {"source_asset_id":"hssd.static.clothes","semantic_category":"clothes","model_id":"046608c3dc2147839f59e9a76474cc9a6f8909b1","render_asset_relpath":"objects/0/046608c3dc2147839f59e9a76474cc9a6f8909b1.glb","render_asset_sha256":"0d6beca9d432e5ad19bec76e3429d97c9adbf350d12d6898f1cc122853e73083","object_config_relpath":"objects/0/046608c3dc2147839f59e9a76474cc9a6f8909b1.object_config.json","object_config_sha256":"ec9e94bb55396fe9d8318c207a78b4fc61c54aa93b064bb0ecf30db5a26cd12d","source_basisu_required":true,"normalized_dimensions_m":[0.52,0.37,0.37],"normalized_origin_policy":"footprint_center_bottom_z_zero","visual_role":"static_presentation_shell","interaction_authority":"none_static_joined_glb"},
    {"source_asset_id":"hssd.static.coffee_cup","semantic_category":"coffee_cup","model_id":"22899dfeb3cfe700149f4fbf87f6d443351cee67","render_asset_relpath":"objects/2/22899dfeb3cfe700149f4fbf87f6d443351cee67.glb","render_asset_sha256":"9b1c328c82e05d35f76e9e3911d03c7dcd7e67a5ec1480f3295bb80e3a47a2aa","object_config_relpath":"objects/2/22899dfeb3cfe700149f4fbf87f6d443351cee67.object_config.json","object_config_sha256":"ba2f39e1b9aca16fabb3457be2734884d3865e16c09a817d61159eda14a615ca","source_basisu_required":true,"normalized_dimensions_m":[0.167,0.11,0.1235],"normalized_origin_policy":"footprint_center_bottom_z_zero","visual_role":"static_presentation_shell","interaction_authority":"none_static_joined_glb"},
    {"source_asset_id":"hssd.static.coffee_table","semantic_category":"coffee_table","model_id":"f8a1e9ad71428615e74490c8fe10d309b527ee55","render_asset_relpath":"objects/f/f8a1e9ad71428615e74490c8fe10d309b527ee55.glb","render_asset_sha256":"d80e738b4bad5f7ae347b41423eb9406545f8569e10f676ac969d0b7ae9b4559","object_config_relpath":"objects/f/f8a1e9ad71428615e74490c8fe10d309b527ee55.object_config.json","object_config_sha256":"04981a3a00be459c68754db73727ca2b9bf9133ba0d31a52e5533663a09c7666","source_basisu_required":true,"normalized_dimensions_m":[1.218721,0.611944,0.441754],"normalized_origin_policy":"footprint_center_bottom_z_zero","visual_role":"static_presentation_shell","interaction_authority":"none_static_joined_glb"},
    {"source_asset_id":"hssd.static.desk","semantic_category":"desk","model_id":"8195c2991d03645f5a989b7aa0601161ad34241f","render_asset_relpath":"objects/8/8195c2991d03645f5a989b7aa0601161ad34241f.glb","render_asset_sha256":"9006af4c3a329064395ed022f4ff46c2f7f8b699feb8c44fac5898b6c1f7d112","object_config_relpath":"objects/8/8195c2991d03645f5a989b7aa0601161ad34241f.object_config.json","object_config_sha256":"9c8d0f00dbb4bedeb919cd7b5715286bc66a5a722861baa166bd4d0082e66bc4","source_basisu_required":true,"normalized_dimensions_m":[1.473201,0.683168,0.7874],"normalized_origin_policy":"footprint_center_bottom_z_zero","visual_role":"static_presentation_shell","interaction_authority":"none_static_joined_glb"},
    {"source_asset_id":"hssd.static.dining_table","semantic_category":"dining_table","model_id":"2e7b1f2f87383d209dffd6257b11713dc5ee2952","render_asset_relpath":"objects/2/2e7b1f2f87383d209dffd6257b11713dc5ee2952.glb","render_asset_sha256":"8deda64f959e626741c7ea8b32a1147e3e558842894e80dfa505358544a410db","object_config_relpath":"objects/2/2e7b1f2f87383d209dffd6257b11713dc5ee2952.object_config.json","object_config_sha256":"2e00ed5c2198ebe86102e60798318502fee51d78e67dc9630ee1b97802d7b821","source_basisu_required":true,"normalized_dimensions_m":[1.4986,0.9144,0.769894],"normalized_origin_policy":"footprint_center_bottom_z_zero","visual_role":"static_presentation_shell","interaction_authority":"none_static_joined_glb"},